{
  "tabId": "500123",
  "tabLabel": "example_value",
  "documentId": "500123",
  "pageNumber": "example_value",
  "recipientId": "500123",
  "xPosition": "example_value",
  "yPosition": "example_value",
  "anchorString": "example_value",
  "value": "example_value",
  "required": "example_value",
  "locked": "example_value",
  "maxLength": "example_value",
  "width": "example_value",
  "height": "example_value",
  "font": "example_value",
  "fontSize": "example_value",
  "fontColor": "example_value",
  "bold": "example_value",
  "italic": "example_value",
  "underline": "example_value",
  "validationPattern": "example_value",
  "validationMessage": "example_value",
  "concealValueOnDocument": "example_value"
}